一般的に胃腸の働きを弱めてしまう効果があるので、「天ぷら」と食べ合わせが良くないとされている食べ物は次のうちどれか？,1,スイカ,梅干し,ゆで卵,ソーセージ
トマトにはビタミンCが豊富に含まれていますが、生で食べるとビタミンCを破壊する作用があるのでトマトと食べ合わせない方が良い野菜は次のうちどれか？,3,かぼちゃ,だいこん,きゅうり,れんこん
うなぎの脂を分解して食欲を増進させる効果があるので実際は、「うなぎ」と食べ合わせが良い食べ物は次のうちどれか？,2,ほうれんそう,梅干し,たらこ,ピーマン
どれもお酒のおつまみとしてポピュラーなものではありますが、「枝豆」と食べ合わせが良くないとされている食べ物は次のうちどれか？,4,いかの塩辛,エイヒレ,キムチ,チーズ
お味噌汁の具として普通によく入っているものですが、実は「わかめ」と食べ合わせが良くないとされている食べ物は次のうちどれか？,2,お麩,ねぎ,油揚げ,ほうれんそう
次の4つの選択肢の中で食べ合わせが良くないものの組み合わせを選びなさい？,4,唐揚げ＆レモン,カレー＆ラッキョウ,レバー＆あさり,納豆＆生卵
消化器系の機能を下げる恐れがあり、「きゅうり」との食べ合わせが良くないとされている食べ物は次のうちどれか？,3,牛肉,鶏肉,豚肉,羊肉
栄養価の豊富な「レバー」ですが、胃腸の働きを抑えてしまうため合わせるとよろしくないとされている食べ物は次のうちどれか？,1,みょうが,しょうが,わさび,からし